{"run":2,"commit":"5452f74","metric":1491,"metrics":{},"status":"discard","description":"move all shifts to ALU (alu_shift_stages=(1,3,5))","timestamp":1777674060185,"segment":0,"confidence":null,"asi":{"hypothesis":"moving shifts 1 and 5 to ALU to free VALU slots","result":"regressed +43 cycles","rollback_reason":"ALU shift takes 8 lanes/group, becomes new bottleneck","next_action_hint":"ALU shifts cost 8x more slots than VALU; only shift 3 stays; try keeping (3,) and look elsewhere. Real bottleneck is load throughput (10 gather rounds × 128 = 1280 load cycles min)"}}
{"run":3,"commit":"cf04cae","metric":147734,"metrics":{},"status":"keep","description":"TRUE baseline - pristine HEAD after prior revert","timestamp":1777674801722,"segment":0,"confidence":null,"asi":{"correction":"Previous 1448 baseline was from uncommitted work that was lost during discard revert. True starting point is 147734","hypothesis":"measure true baseline (pristine perf_takehome.py from HEAD)","strategy":"rebuild optimizations from scratch: vectorize with vload/vstore, multiply_add hash stages, arith-select early tree levels, scheduler for cross-round pipelining"}}
{"run":4,"commit":"89c9e9b","metric":1848,"metrics":{},"status":"keep","description":"Full vectorized rewrite w/ list scheduler","timestamp":1777675387618,"segment":0,"confidence":null,"asi":{"baseline_true":147734,"breakdown":"Vectorized with 32 groups of VLEN=8; multiply_add for hash stages 0/2/4; arith-select levels 0/1/2; gather levels 3-10; list scheduler packs VLIW bundles","hypothesis":"full vectorized rewrite with multiply_add + arith-select levels 0-2 + list scheduler","next_ideas":"1) Move stage-3 shift to ALU to free valu; 2) Pipeline more aggressively; 3) Try level-3 arith-select if valu has slack; 4) Merge val^node into multiply_add via algebra"}}
{"run":5,"commit":"f5ade51","metric":1811,"metrics":{},"status":"keep","description":"Stage-3 shift to ALU per-lane","timestamp":1777675423068,"segment":0,"confidence":null,"asi":{"delta":-37,"hypothesis":"stage-3 shift on ALU frees valu slot (1/group/round)","note":"ALU was completely idle; even 8-lane cost is offset by scheduler flexibility"}}
{"run":6,"commit":"c137176","metric":1759,"metrics":{},"status":"keep","description":"Bit-extract on ALU (val&amp;1)","timestamp":1777675437158,"segment":0,"confidence":null,"asi":{"delta":-52,"hypothesis":"bit-extract (val&1) on ALU per-lane frees 1-2 valu ops per group per round"}}
{"run":7,"commit":"c137176","metric":1786,"metrics":{},"status":"discard","description":"Move stage-5 shift to ALU too","timestamp":1777675461821,"segment":0,"confidence":null,"asi":{"delta":27,"hypothesis":"move stage-5 shift to ALU also","rollback_reason":"+27 cycles; stage-5 ALU shift causes scheduling interference with bit-extract (both compete for 12 alu/cycle)","next_action_hint":"keep stage-5 on valu; try stage-1 alternative or different direction"}}
{"run":8,"commit":"61dbe31","metric":1728,"metrics":{},"status":"keep","description":"Stage-1 shift on ALU","timestamp":1777675472244,"segment":0,"confidence":null,"asi":{"delta":-31,"hypothesis":"move stage-1 shift to ALU (not stage 5) — stage 1 is earlier in chain, better for scheduler"}}
{"run":9,"commit":"61dbe31","metric":1728,"metrics":{},"status":"discard","description":"Scheduler: priority-first sort","timestamp":1777675542789,"segment":0,"confidence":null,"asi":{"delta":0,"hypothesis":"sort by priority first, then engine","note":"identical; priorities dominated the existing tiebreaker"}}
{"run":10,"commit":"44cc632","metric":1717,"metrics":{},"status":"keep","description":"Scheduled setup loads","timestamp":1777675628214,"segment":0,"confidence":null,"asi":{"delta":-11,"hypothesis":"move setup const/tree loads into scheduler so they overlap with broadcasts","note":"smaller than expected gain — loads weren't fully idle, or critical path still elsewhere"}}
{"run":11,"commit":"44cc632","metric":1744,"metrics":{},"status":"discard","description":"Level-2 bit extracts on ALU","timestamp":1777741432054,"segment":0,"confidence":null,"asi":{"delta":27,"hypothesis":"move level-2 bit extracts to per-lane ALU","rollback_reason":"+27 cycles; 8x alu cost outweighs valu savings for only 2 rounds"}}
{"run":12,"commit":"44cc632","metric":1752,"metrics":{},"status":"discard","description":"Level-2 algebraic refactor with ALU bits","timestamp":1777741488550,"segment":0,"confidence":null,"asi":{"delta":35,"hypothesis":"algebraic refactor of level-2 select + ALU bit extract","note":"regressed; the 3-mad chain has deeper critical path than the tree form (original had 2 parallel mads r0/r1, then 1 sub+mad). Algebraic form is strictly sequential."}}
{"run":13,"commit":"44cc632","metric":0,"metrics":{},"status":"crash","description":"Cross-round dep relaxation (gather bc decoupled)","timestamp":1777741680896,"segment":0,"confidence":null,"asi":{"bug_hypothesis":"gather bc for round N+1 writes g_node which might be needed by round N's hash x0 if level>=1; but I tracked node_war = [x0 of prev]. Somewhere WAR is missing","hypothesis":"decouple gather bc deps from prev hash completion","next_action_hint":"need more careful tracking; maybe t1/t2 WAR or val WAR is the actual issue","rollback_reason":"correctness failure (215 diffs starting at group 2)"}}
{"run":14,"commit":"44cc632","metric":1727,"metrics":{},"status":"discard","description":"Decouple gather bc from p_up","timestamp":1777741771704,"segment":0,"confidence":null,"asi":{"delta":10,"hypothesis":"decouple gather bc from p_up dep","note":"slightly slower. Priority change from dep reduction seemingly shifted scheduling in a bad direction. Dep reduction alone doesn't help because critical path through hash wasn't loosened."}}
{"run":15,"commit":"44cc632","metric":0,"metrics":{},"status":"crash","description":"Alias g_t2=g_node to free scratch","timestamp":1777741978561,"segment":0,"confidence":null,"asi":{"bug":"aliasing g_t2=g_node breaks level-2 sel which reads both node and t2 in mad(node, t1, t2, node) — same scratch read twice corrupts result","hypothesis":"alias g_t2 onto g_node to save 256 scratch words for level-3 arith-select","next_action_hint":"could alias g_t2 to g_t1 only for hash stages (where t1/t2 used at different times) but keep them distinct for level-2"}}
{"run":16,"commit":"44cc632","metric":1725,"metrics":{},"status":"discard","description":"ASAP-level primary key","timestamp":1777742005173,"segment":0,"confidence":null,"asi":{"delta":8,"hypothesis":"prefer ops with lower ASAP (earlier-in-program) to drive early-round work first","note":"marginal regression"}}
{"run":17,"commit":"44cc632","metric":1820,"metrics":{},"status":"discard","description":"h3a on ALU","timestamp":1777742036571,"segment":0,"confidence":null,"asi":{"delta":103,"hypothesis":"h3a add on ALU per-lane","rollback_reason":"ALU becomes bottleneck; 8x cost not worth 1 valu op savings"}}
{"run":18,"commit":"44cc632","metric":1727,"metrics":{},"status":"discard","description":"x0-based node_war relaxation","timestamp":1777742090116,"segment":0,"confidence":null,"asi":{"delta":10,"hypothesis":"track x0-based node_war fence; relax gather bc dep","note":"no meaningful gain. Critical path is elsewhere - probably the hash chain itself."}}
{"run":19,"commit":"44cc632","metric":1820,"metrics":{},"status":"discard","description":"Stages 1,3,5 all on ALU","timestamp":1777742175274,"segment":0,"confidence":null,"asi":{"delta":103,"hypothesis":"move stage-5 shift to ALU while keeping stages 1,3 on ALU","rollback_reason":"+103 cycles; all three shifts on ALU oversaturates ALU engine","verified":"earlier attempt (2 stages on ALU) also regressed"}}
{"run":20,"commit":"44cc632","metric":1717,"metrics":{},"status":"discard","description":"Scheduler w/ descendants count","timestamp":1777742258328,"segment":0,"confidence":null,"asi":{"delta":0,"hypothesis":"priority + descendants count + engine","note":"identical. Scheduler ordering not the bottleneck."}}
{"run":21,"commit":"d296f45","metric":1702,"metrics":{},"status":"keep","description":"g_val_ptr via flow add_imm","timestamp":1777742341741,"segment":0,"confidence":null,"asi":{"delta":-15,"hypothesis":"compute g_val_ptr via flow add_imm to free 32 load slots for gather","savings":"32 load slots freed from prolog"}}
{"run":22,"commit":"d296f45","metric":1702,"metrics":{},"status":"discard","description":"Move tree/gather base addr to flow","timestamp":1777742371207,"segment":0,"confidence":null,"asi":{"delta":0,"hypothesis":"move more addresses to flow add_imm","note":"no change; load engine already wasn't bottleneck in prolog after previous flow change"}}
{"run":23,"commit":"d296f45","metric":1712,"metrics":{},"status":"discard","description":"In-place shifts (h1b/h3b/h5b -&gt; val) w/ strict deps","timestamp":1777742579228,"segment":0,"confidence":null,"asi":{"delta":10,"hypothesis":"in-place shifts for h1b/h3b/h5b (writing to val)","learning":"scheduler can place h1b before h1a in different cycles; forcing strict dep (h1b after h1a) loses same-cycle parallelism; -10 cycles without the strict dep is unsafe (correctness fails); with strict dep, +10 cycles","rollback_reason":"no scheduling scheme makes this a net win"}}
{"run":24,"commit":"74c5569","metric":1683,"metrics":{},"status":"keep","description":"Split val/p dep chains (level-0 no pdep on node)","timestamp":1777742744188,"segment":0,"confidence":null,"asi":{"delta":-19,"hypothesis":"separate val-chain vs p-chain deps; level-0 p_up now includes pdeps for WAW protection","learning":"previous failure was missing level-0 p_up WAW dep on prev p_up"}}
{"run":25,"commit":"afc7693","metric":1457,"metrics":{},"status":"keep","description":"x0-tracked node_war + val/p/node dep split","timestamp":1777742813178,"segment":0,"confidence":null,"asi":{"delta":-226,"hypothesis":"track x0 per round + separate val/p/node-war dep chains","learning":"x0 is the last read of g_node; gather bc for next round can start after prev x0 instead of prev final_val, saving many cycles of serialization"}}
{"run":26,"commit":"4f0cfba","metric":1289,"metrics":{},"status":"keep","description":"Level-3 bit extracts on ALU","timestamp":1777742905942,"segment":0,"confidence":5.578947368421052,"asi":{"delta":-168,"hypothesis":"level-3 bit extracts on per-lane ALU frees major valu pressure (5 &-ops per group per L3 round)","current_best":1289,"next":"look at profile for new bottleneck"}}
{"run":27,"commit":"4f0cfba","metric":1289,"metrics":{},"status":"discard","description":"h1b back to VALU","timestamp":1777743003723,"segment":0,"confidence":4.96875,"asi":{"delta":0,"hypothesis":"move h1b back to VALU to reduce ALU pressure","note":"no change. Bottleneck is elsewhere."}}
{"run":28,"commit":"4f0cfba","metric":1325,"metrics":{},"status":"discard","description":"p_update bit extract on VALU","timestamp":1777743060855,"segment":0,"confidence":4.184210526315789,"asi":{"delta":36,"hypothesis":"move p_update bit extract back to VALU (1 op vs 8 alu)","rollback_reason":"+36 cycles; VALU becomes new bottleneck"}}
{"run":29,"commit":"e7caff6","metric":1287,"metrics":{},"status":"keep","description":"Eliminate redundant b0_hi recompute in L3","timestamp":1777743107058,"segment":0,"confidence":3.8333333333333335,"asi":{"delta":-2,"hypothesis":"eliminate redundant b0_hi recomputation (t1 still has b0)","saved_alu":512}}
{"run":30,"commit":"e7caff6","metric":1464,"metrics":{},"status":"discard","description":"Expand L2/L3 tmp slots","timestamp":1777743158070,"segment":0,"confidence":3.1262135922330097,"asi":{"delta":177,"hypothesis":"expand L2/L3 shared tmp slots","rollback_reason":"more tmps reduced scheduler serialization but removed a critical constraint that was forcing better schedules","note":"fewer tmps with serialization may act as a bottleneck that forces better packing elsewhere"}}
{"run":31,"commit":"5dff48b","metric":1218,"metrics":{},"status":"keep","description":"Reduce L2/L3 tmps to 2 each","timestamp":1777743173635,"segment":0,"confidence":3.3333333333333335,"asi":{"delta":-69,"hypothesis":"fewer shared tmp slots (2 instead of 3/4) force tighter scheduling","insight":"artificial scarcity in shared regs forces scheduler to sequence L2/L3 more efficiently, avoiding low-utilization stretches"}}
{"run":32,"commit":"5dff48b","metric":1256,"metrics":{},"status":"discard","description":"1 L2/L3 tmp each","timestamp":1777743188237,"segment":0,"confidence":2.8220858895705523,"asi":{"delta":38,"hypothesis":"1 tmp per category - too tight, too much serialization","note":"2 tmps is the sweet spot"}}
{"run":33,"commit":"5dff48b","metric":1218,"metrics":{},"status":"discard","description":"l2=3 tmps, l3=2","timestamp":1777743210269,"segment":0,"confidence":2.4468085106382977,"asi":{"delta":0,"hypothesis":"l2=3 tmps, l3=2"}}
{"run":34,"commit":"5dff48b","metric":1237,"metrics":{},"status":"discard","description":"l2=1, l3=2","timestamp":1777743223949,"segment":0,"confidence":2.277227722772277,"asi":{"delta":19,"hypothesis":"l2=1 tmp, l3=2"}}
{"run":35,"commit":"5dff48b","metric":1563,"metrics":{},"status":"discard","description":"h5b to ALU","timestamp":1777743297897,"segment":0,"confidence":2.1296296296296298,"asi":{"delta":345,"hypothesis":"h5b to ALU","rollback_reason":"alu saturates"}}
{"run":36,"commit":"5dff48b","metric":1277,"metrics":{},"status":"discard","description":"l2=2, l3=3","timestamp":1777743377050,"segment":0,"confidence":2.0353982300884956,"asi":{"delta":59,"hypothesis":"l2=2, l3=3"}}
{"run":37,"commit":"5dff48b","metric":1222,"metrics":{},"status":"discard","description":"ASAP+priority scheduler key","timestamp":1777743402694,"segment":0,"confidence":1.9491525423728813,"asi":{"delta":4,"hypothesis":"ASAP+priority sort key"}}
{"run":38,"commit":"a0b5b42","metric":1201,"metrics":{},"status":"keep","description":"Precompute gather base vectors","timestamp":1777743544315,"segment":0,"confidence":1.9221789883268483,"asi":{"delta":-17,"hypothesis":"precompute gather base vectors at setup (save 1 valu per gather-round)","savings":"256 valu slots, -17 cycles actual"}}
{"run":39,"commit":"a0b5b42","metric":1308,"metrics":{},"status":"discard","description":"h1b back to VALU","timestamp":1777743605970,"segment":0,"confidence":1.776978417266187,"asi":{"delta":107,"hypothesis":"h1b back to valu","rollback_reason":"valu becomes bottleneck"}}
{"run":40,"commit":"a0b5b42","metric":0,"metrics":{},"status":"crash","description":"Remove spurious L3 vselect deps","timestamp":1777743705318,"segment":0,"confidence":1.776978417266187,"asi":{"bug":"removing [r0] dep from r1 causes IndexError in load_offset at cycle 649, suggesting p value corruption","hypothesis":"remove spurious r0 dep from r1, r2 dep from r3 in L3 selection tree","next_action_hint":"the serialization might be hiding a latent WAR hazard that arises when ops run more in parallel","rollback_reason":"correctness failure"}}
{"run":41,"commit":"8704b5a","metric":1169,"metrics":{},"status":"keep","description":"L3 tmp2 eliminates b1_hi recompute","timestamp":1777743850680,"segment":0,"confidence":1.9578947368421054,"asi":{"delta":-32,"hypothesis":"add l3_tmp2, store r3 there to preserve tmp1 (b1). eliminate b1_hi recompute","savings":"128 valu slots saved. scratch 1466/1536"}}
{"run":42,"commit":"8704b5a","metric":1172,"metrics":{},"status":"discard","description":"b2 to ALU per-lane","timestamp":1777743887699,"segment":0,"confidence":1.690909090909091,"asi":{"delta":3,"hypothesis":"b2 alu per-lane","rollback_reason":"marginally worse"}}
{"run":43,"commit":"8704b5a","metric":1188,"metrics":{},"status":"discard","description":"L2 bit extracts on ALU","timestamp":1777743981706,"segment":0,"confidence":1.537190082644628,"asi":{"delta":19,"hypothesis":"L2 b0/b1 on ALU per-lane"}}
{"run":44,"commit":"1b28040","metric":1154,"metrics":{},"status":"keep","description":"L1 select via vselect","timestamp":1777744067737,"segment":0,"confidence":1.2352941176470589,"asi":{"delta":-15,"hypothesis":"L1 select via flow vselect (saves 1 valu op per group per round)","note":"flow 480 -> 544 still non-bottleneck"}}
{"run":45,"commit":"1b28040","metric":1154,"metrics":{},"status":"discard","description":"Priority-first sort","timestamp":1777744167630,"segment":0,"confidence":1.251063829787234,"asi":{"delta":0,"hypothesis":"priority first sort_key"}}
{"run":46,"commit":"1b28040","metric":1154,"metrics":{},"status":"discard","description":"x0-based node_war restoration","timestamp":1777744260007,"segment":0,"confidence":1.240506329113924,"asi":{"delta":0,"hypothesis":"x0-based node_war fence for gather bc","note":"no gain since pdeps chain (requires final_val via bit) still dominates"}}
{"run":47,"commit":"1b28040","metric":1229,"metrics":{},"status":"discard","description":"L3 tmps = 3","timestamp":1777744387139,"segment":0,"confidence":1.1783567134268538,"asi":{"delta":75,"hypothesis":"3 L3 tmps"}}
{"run":48,"commit":"1b28040","metric":1154,"metrics":{},"status":"discard","description":"l2 tmps=3","timestamp":1777744401578,"segment":0,"confidence":1.1620553359683794,"asi":{"delta":0,"hypothesis":"l2 tmps=3, l3=2"}}
{"run":49,"commit":"1b28040","metric":1483,"metrics":{},"status":"discard","description":"h1c to ALU per-lane","timestamp":1777744438500,"segment":0,"confidence":1.1643564356435643,"asi":{"delta":329,"hypothesis":"h1c to ALU per-lane","rollback_reason":"ALU oversaturates +massive cycles. Critical path lengthens due to 8-lane ALU serialization"}}
{"run":50,"commit":"1b28040","metric":1154,"metrics":{},"status":"discard","description":"Level-0 p_up on valu","timestamp":1777744479860,"segment":0,"confidence":1.1620553359683794,"asi":{"delta":0,"hypothesis":"level-0 p_up on valu (1 op vs 8 alu)","note":"no change"}}
{"run":51,"commit":"1b28040","metric":1154,"metrics":{},"status":"discard","description":"Tighter hash broadcast deps","timestamp":1777744535149,"segment":0,"confidence":1.1395348837209303,"asi":{"delta":0,"hypothesis":"tighter per-stage hash broadcast deps"}}
{"run":52,"commit":"1b28040","metric":1177,"metrics":{},"status":"discard","description":"Fuse hash stage 2+3","timestamp":1777744750801,"segment":0,"confidence":1.1307692307692307,"asi":{"delta":23,"hypothesis":"fuse h2+h3 via precomputed constants (mad*33+c2+c3) XOR (mad*16896+c2<<9)","rollback_reason":"+23 cycles despite saving 8 alu per group per round; critical path shorter theoretically but scheduler did worse"}}
{"run":53,"commit":"1223146","metric":1151,"metrics":{},"status":"keep","description":"l2_b1_tmps=1","timestamp":1777744798337,"segment":0,"confidence":1.1228733459357279,"asi":{"delta":-3,"hypothesis":"l2_b1_tmps=1 (single shared b1 buffer forces tighter level-2 serialization)","interesting":"having ONE shared scratch tighter-schedules level-2 rounds, gaining a few cycles"}}
{"run":54,"commit":"1223146","metric":1204,"metrics":{},"status":"discard","description":"l3 tmps = 1","timestamp":1777744820457,"segment":0,"confidence":1.104089219330855,"asi":{"delta":53,"hypothesis":"l3 tmps = 1","rollback_reason":"too tight"}}
{"run":55,"commit":"8cba4c4","metric":1148,"metrics":{},"status":"keep","description":"Scheduler tiebreak -i","timestamp":1777744850625,"segment":0,"confidence":1.2903225806451613,"asi":{"delta":-3,"hypothesis":"tiebreak on -i (prefer later round ops)","note":"subtle scheduler change"}}
{"run":56,"commit":"8cba4c4","metric":1199,"metrics":{},"status":"discard","description":"Hash-based tiebreak","timestamp":1777744884845,"segment":0,"confidence":1.7543859649122806,"asi":{"delta":51,"hypothesis":"hash-based tiebreak"}}
{"run":57,"commit":"8cba4c4","metric":1148,"metrics":{},"status":"discard","description":"Priority-first sort, -i tiebreak","timestamp":1777744921829,"segment":0,"confidence":1.8461538461538463,"asi":{"delta":0,"hypothesis":"priority-first, engine second"}}
{"run":58,"commit":"8cba4c4","metric":1148,"metrics":{},"status":"discard","description":"ASAP-level tertiary sort","timestamp":1777744958818,"segment":0,"confidence":1.9230769230769231,"asi":{"delta":0,"hypothesis":"ASAP-level tertiary sort","note":"no change"}}
{"run":59,"commit":"8cba4c4","metric":1210,"metrics":{},"status":"discard","description":"l3 tmps = 3 (l2=1)","timestamp":1777744987279,"segment":0,"confidence":2,"asi":{"delta":62,"hypothesis":"l3 tmps = 3"}}
{"run":60,"commit":"660b830","metric":1148,"metrics":{},"status":"keep","description":"Strengthen checks.sh with multi-seed correctness","timestamp":1777745161686,"segment":0,"confidence":2.127659574468085,"asi":{"hypothesis":"strengthen autoresearch.checks.sh to run multi-seed correctness test; discovered that working tree had accidental broken code that happened to pass seed=123 but fails others","note":"safety improvement, not a performance change","delta":0}}
{"run":61,"commit":"660b830","metric":1148,"metrics":{},"status":"discard","description":"Flow-first engine rank","timestamp":1777745333695,"segment":0,"confidence":2.127659574468085,"asi":{"delta":0,"hypothesis":"flow-first engine_rank"}}
{"run":62,"commit":"660b830","metric":1148,"metrics":{},"status":"discard","description":"Reverse group iteration","timestamp":1777745350177,"segment":0,"confidence":2.127659574468085,"asi":{"delta":0,"hypothesis":"iterate groups in reverse order"}}
{"run":63,"commit":"660b830","metric":1172,"metrics":{},"status":"discard","description":"Bit-reverse group iter","timestamp":1777745366708,"segment":0,"confidence":2.142857142857143,"asi":{"delta":24,"hypothesis":"bit-reverse group iteration order"}}
{"run":64,"commit":"660b830","metric":1178,"metrics":{},"status":"discard","description":"Priority + ASAP/4 bonus","timestamp":1777745414674,"segment":0,"confidence":2.158273381294964,"asi":{"delta":30,"hypothesis":"priority + asap bonus"}}
